{
  "id": "alert-lab-0001",
  "tenant_id": "lab",
  "detection": {"rule_id": "wazuh-5710", "rule_version": "1.0", "source": "wazuh"},
  "status": "escalated",
  "severity": "medium",
  "confidence": 0.82,
  "event_refs": ["evt-lab-0001"],
  "observable_refs": ["obs-ip-0001", "obs-host-0001"],
  "playbook_refs": ["PB-WAZUH-001"],
  "analyst_notes": [
    {"author": "analyst-tier1", "at": "2026-08-30T04:01:30Z", "text": "Five failed SSH logins from one source within one minute; escalating per detection threshold."}
  ],
  "created_at": "2026-08-30T04:00:03Z",
  "correlation": {"key": "ssh-bruteforce:198.51.100.10:lab-endpoint-01", "window_seconds": 60},
  "case_ref": "case-lab-0001"
}
